{
  "command": "pi --print --no-session --no-skills --skill '$BENCHMARK_SKILL' --no-context-files --tools read,grep,find,ls --model codex/gpt-5.5 --thinking high",
  "cwd": "$BENCHMARK_WORKSPACE",
  "duration_seconds": 88.609,
  "host": "pi",
  "host_version": "0.80.6",
  "model": "codex/gpt-5.5",
  "model_observation": "requested_by_cli",
  "output_path": "pi-output.md",
  "output_sha256": "3696cf220a717a0debab1c69e91a1a78a1aad2d4536e293c5a00692b15419c0b",
  "prompt_path": "prompt.md",
  "prompt_sha256": "15b25396696901c46fd0dde92cd556d10f30179ca38df969ab796228ce6d207f",
  "prompt_transport": "argument",
  "reasoning_observation": "requested_by_cli",
  "reasoning_profile": "high",
  "returncode": 0,
  "runner_os": "macOS-15.7.7-arm64-arm-64bit-Mach-O",
  "schema": "design-craft.cross-agent-run.v2",
  "skill_install_mode": "isolated_project_copy",
  "skill_path": "$BENCHMARK_WORKSPACE/.pi/skills/design-craft",
  "skill_tree_sha256": "f3672d8158d5b2acf09725eb6c6a1bc4928afaf81fcec3f7ee03897a03a8cbe0",
  "started_at": "2026-07-25T02:13:11Z",
  "stderr_bytes": 0,
  "stderr_sha256": "e3b0c44298fc1c149afbf4c8996fb92427ae41e4649b934ca495991b7852b855",
  "timeout_seconds": 600,
  "workspace_kind": "repo_external_isolated_project",
  "worktree_after_sha256": "f95731daef3bc1a0fb17449e7184a87b15857dd8f9a9b364cb174939971cb2e2",
  "worktree_before_sha256": "f95731daef3bc1a0fb17449e7184a87b15857dd8f9a9b364cb174939971cb2e2",
  "worktree_unchanged": true
}
