{
  "command": "codex exec --ephemeral --sandbox read-only --skip-git-repo-check --ignore-rules -C '$BENCHMARK_WORKSPACE' --model gpt-5.6-sol -c 'model_reasoning_effort=\"max\"' --output-last-message '$BENCHMARK_WORKSPACE/.design-craft-host-output.md' -",
  "cwd": "$BENCHMARK_WORKSPACE",
  "duration_seconds": 304.515,
  "host": "codex",
  "host_version": "codex-cli 0.145.0",
  "model": "gpt-5.6-sol",
  "model_observation": "requested_by_cli",
  "output_path": "codex-output.md",
  "output_sha256": "6c53aa5abe059f7ffbb688d8006a844427717976734f6ed7818aebf928aa7308",
  "prompt_path": "prompt.md",
  "prompt_sha256": "61f2e14e7f03ad0f21bff2db3770e0b6c0ffba120aa7598dab1f73411256b2bd",
  "prompt_transport": "stdin",
  "reasoning_observation": "requested_by_cli",
  "reasoning_profile": "max",
  "returncode": 0,
  "runner_os": "macOS-15.7.7-arm64-arm-64bit-Mach-O",
  "schema": "design-craft.cross-agent-run.v2",
  "skill_install_mode": "isolated_project_copy",
  "skill_path": "$BENCHMARK_WORKSPACE/.agents/skills/design-craft",
  "skill_tree_sha256": "f3672d8158d5b2acf09725eb6c6a1bc4928afaf81fcec3f7ee03897a03a8cbe0",
  "started_at": "2026-07-25T02:07:21Z",
  "stderr_bytes": 95207,
  "stderr_sha256": "916b728ea8ff2a09dba7e615095ebd18a72d488f24f779ac05a70c2bb507486a",
  "timeout_seconds": 600,
  "workspace_kind": "repo_external_isolated_project",
  "worktree_after_sha256": "7d0baa625aeac4cd46eb2ce7a2b9c83e0717a7c1b3fbdcecc024ec32a398bd43",
  "worktree_before_sha256": "7d0baa625aeac4cd46eb2ce7a2b9c83e0717a7c1b3fbdcecc024ec32a398bd43",
  "worktree_unchanged": true
}
