{
  "command": "codex exec --ephemeral --sandbox read-only --skip-git-repo-check --ignore-rules -C '$BENCHMARK_WORKSPACE' --model gpt-5.6-sol -c 'model_reasoning_effort=\"max\"' --output-last-message '$BENCHMARK_WORKSPACE/.design-craft-host-output.md' -",
  "cwd": "$BENCHMARK_WORKSPACE",
  "duration_seconds": 238.892,
  "host": "codex",
  "host_version": "codex-cli 0.145.0",
  "model": "gpt-5.6-sol",
  "model_observation": "requested_by_cli",
  "output_path": "codex-output.md",
  "output_sha256": "46ac6c5f0cf09f910330f76230ffbc98657995598f03b2d6ccac76634e42b920",
  "prompt_path": "prompt.md",
  "prompt_sha256": "15b25396696901c46fd0dde92cd556d10f30179ca38df969ab796228ce6d207f",
  "prompt_transport": "stdin",
  "reasoning_observation": "requested_by_cli",
  "reasoning_profile": "max",
  "returncode": 0,
  "runner_os": "macOS-15.7.7-arm64-arm-64bit-Mach-O",
  "schema": "design-craft.cross-agent-run.v2",
  "skill_install_mode": "isolated_project_copy",
  "skill_path": "$BENCHMARK_WORKSPACE/.agents/skills/design-craft",
  "skill_tree_sha256": "64a3997fa784e6614350506cc4a608d72451cdcc6a6b7df3c6d65234c2662230",
  "started_at": "2026-07-24T10:12:25Z",
  "stderr_bytes": 60658,
  "stderr_sha256": "d1930b5647f512fa1f7a1591985c158275b2a5c02a881a5064ab2257328636c0",
  "timeout_seconds": 600,
  "workspace_kind": "repo_external_isolated_project",
  "worktree_after_sha256": "b4a4b0b15ce612bc39919ed7803a2906c388ec713e159b4627d7de48780509e9",
  "worktree_before_sha256": "b4a4b0b15ce612bc39919ed7803a2906c388ec713e159b4627d7de48780509e9",
  "worktree_unchanged": true
}
